source_id,title,author,source_archive,landing_page_url,language_variety,role,status,known_subpage_count,license_or_reuse_status,attribution_required,form_evidence,duplicate_policy,cleaning_risk,next_action
ws_alfieri_rime_1912,Rime varie (1912 edition),Vittorio Alfieri,Italian Wikisource,"https://it.wikisource.org/wiki/Rime_varie_(Alfieri,_1912)",standard Italian,core_standard_italian,activated,195,CC BY-SA / GFDL metadata on Italian Wikisource; retain page URL author source edition and license metadata,yes,Revision-pinned audit retained 45 pages with exactly 14 cleaned lines,Use this edition only; exclude 1903 parallel edition,Removed isolated rendered bracket lines and displayed line markers; preserved verse text,Included in sonnets_expanded_v2 from 45 committed page revisions
ws_foscolo_sonetti,Sonetti (Foscolo),Ugo Foscolo,Italian Wikisource,https://it.wikisource.org/wiki/Sonetti_(Foscolo),standard Italian,core_standard_italian,activated,12,CC BY-SA 3.0 / GFDL metadata on Italian Wikisource; retain page URL author Ugo Foscolo editor Giuseppe Caleffi source scan license links and share-alike notice,yes,Revision-pinned 1835-edition audit retained 12 pages with exactly 14 cleaned lines,Use only the audited 1835 edition pages; check active corpus exact duplicates,Decorative initials inline markup and displayed line markers were joined or removed without changing verse text,Included in sonnets_expanded_v3 from 12 committed edition and Opera-record revisions
ws_varchi_infermita,"Sonetti per la infermità, e guarigione di Cosimo I dei Medici",Benedetto Varchi,Italian Wikisource,"https://it.wikisource.org/wiki/Sonetti_per_la_infermit%C3%A0,_e_guarigione_di_Cosimo_I_dei_Medici",standard Italian,core_standard_italian,activated,33,CC BY-SA 3.0 / GFDL metadata on Italian Wikisource; retain page URL author Benedetto Varchi source scan Indice:Varchi - Sonetti.pdf license links and share-alike notice,yes,Revision-pinned audit retained 33 pages with exactly 14 cleaned lines and no exact v3 duplicates,Use the 1821 Magheri edition only,Editorial front matter excluded; displayed line markers removed while verse text and historical spelling were preserved,Included in sonnets_expanded_v4 from 33 committed page revisions
ws_belli_sonetti_romaneschi,Sonetti romaneschi,Giuseppe Gioachino Belli,Italian Wikisource,https://it.wikisource.org/wiki/Sonetti_romaneschi,Romano dialect,auxiliary_dialectal,excluded_from_core_language_variety,2042,Italian Wikisource collection metadata recorded; no page-level reuse audit required for an excluded source,yes,Collection identity confirmed; page-level form audit deliberately stopped,Do not include in the core corpus,Approximately 68 percent of a combined v3-plus-Belli corpus would be Romanesco,No extraction unless a separate dialect-conditioned experiment is explicitly approved
ws_aretino_sonetti_lussuriosi_1792,Sonetti lussuriosi (1792 edition),Pietro Aretino,Italian Wikisource,https://it.wikisource.org/wiki/Sonetti_lussuriosi_(edizione_1792),standard Italian,undecided,audit_only_explicit_content,,Italian Wikisource page metadata must be recorded before use,yes,Collection title plus cleaned 14-line validation,Check active corpus and alternate editions,Explicit sexual content; audit reports must not retain text samples,Audit only; require a separate activation decision
biblioteca_italiana_tei_poetry,Biblioteca Italiana TEI poetry collections,Multiple authors,Biblioteca Italiana,https://bibliodlcm.web.uniroma1.it/it/biblioteca-italiana,unknown,core_standard_italian,blocked_pending_terms_and_access,,Download availability reported; exact work-level reuse terms not yet confirmed,likely,TEI poem structure must be validated per selected work,Compare selected text against active corpus,Access and license ambiguity,Confirm official terms and select named works
ws_category_sonetti,Categoria:Sonetti,Multiple authors,Italian Wikisource,https://it.wikisource.org/wiki/Categoria:Sonetti,mixed,discovery_only,discovery_only,6521,Italian Wikisource page metadata applies to individual pages,yes,Category label alone is insufficient,No bulk ingestion; select named collections only,Mixed forms editions dialects and duplicates,Use only to discover named candidates
project_gutenberg_italian_sonnets,Italian poetry records,Multiple authors,Project Gutenberg,https://www.gutenberg.org/browse/shelves/25,en and it mixed,not_applicable,not_prioritized,,Record exact record-level terms if reconsidered,yes,No material new original Italian sonnet collection identified,Do not ingest translation records,Translation and target-language mismatch,Revisit only after named original-Italian collection is found
